
Uncertainty Expression Evaluation (Fair Comparison)

Model: mistralai/Mistral-7B-Instruct-v0.2
Device: mps
Vector directory: data/vectors/uncertainty_mistral_7b_instruct_v0.2

Loading model...
`torch_dtype` is deprecated! Use `dtype` instead!
Loading checkpoint shards:   0%|          | 0/3 [00:00<?, ?it/s]Loading checkpoint shards:  33%|███▎      | 1/3 [00:02<00:04,  2.50s/it]Loading checkpoint shards:  67%|██████▋   | 2/3 [00:04<00:02,  2.44s/it]Loading checkpoint shards: 100%|██████████| 3/3 [00:07<00:00,  2.35s/it]Loading checkpoint shards: 100%|██████████| 3/3 [00:07<00:00,  2.38s/it]

Loading evaluation sets...
Uncertain prompts: 20
Certain prompts: 20

Loading steering vector...
Best layer: 14
Vector norm: 3.0156

1. Base model (no prompt, no steering)...
Base (uncertain):   0%|          | 0/20 [00:00<?, ?it/s]Base (uncertain):   5%|▌         | 1/20 [00:09<02:56,  9.27s/it]Base (uncertain):  10%|█         | 2/20 [00:19<02:59,  9.98s/it]Base (uncertain):  15%|█▌        | 3/20 [00:29<02:51, 10.10s/it]Base (uncertain):  20%|██        | 4/20 [00:40<02:42, 10.16s/it]Base (uncertain):  25%|██▌       | 5/20 [00:46<02:12,  8.84s/it]Base (uncertain):  30%|███       | 6/20 [00:56<02:10,  9.32s/it]Base (uncertain):  35%|███▌      | 7/20 [01:07<02:04,  9.61s/it]Base (uncertain):  40%|████      | 8/20 [01:17<01:57,  9.80s/it]Base (uncertain):  45%|████▌     | 9/20 [01:27<01:49,  9.94s/it]Base (uncertain):  50%|█████     | 10/20 [01:37<01:40, 10.02s/it]Base (uncertain):  55%|█████▌    | 11/20 [01:48<01:30, 10.09s/it]Base (uncertain):  60%|██████    | 12/20 [01:58<01:21, 10.13s/it]Base (uncertain):  65%|██████▌   | 13/20 [02:08<01:11, 10.15s/it]Base (uncertain):  70%|███████   | 14/20 [02:18<01:01, 10.17s/it]Base (uncertain):  75%|███████▌  | 15/20 [02:28<00:50, 10.18s/it]Base (uncertain):  80%|████████  | 16/20 [02:39<00:40, 10.19s/it]Base (uncertain):  85%|████████▌ | 17/20 [02:49<00:30, 10.21s/it]Base (uncertain):  90%|█████████ | 18/20 [02:59<00:20, 10.21s/it]Base (uncertain):  95%|█████████▌| 19/20 [03:09<00:10, 10.21s/it]Base (uncertain): 100%|██████████| 20/20 [03:20<00:00, 10.23s/it]Base (uncertain): 100%|██████████| 20/20 [03:20<00:00, 10.01s/it]
Base (certain):   0%|          | 0/20 [00:00<?, ?it/s]Base (certain):   5%|▌         | 1/20 [00:03<01:14,  3.92s/it]Base (certain):  10%|█         | 2/20 [00:10<01:34,  5.22s/it]Base (certain):  15%|█▌        | 3/20 [00:13<01:18,  4.64s/it]Base (certain):  20%|██        | 4/20 [00:20<01:25,  5.32s/it]Base (certain):  25%|██▌       | 5/20 [00:28<01:36,  6.46s/it]Base (certain):  30%|███       | 6/20 [00:36<01:34,  6.71s/it]Base (certain):  35%|███▌      | 7/20 [00:43<01:30,  6.94s/it]Base (certain):  40%|████      | 8/20 [00:53<01:35,  7.93s/it]Base (certain):  45%|████▌     | 9/20 [01:00<01:23,  7.59s/it]Base (certain):  50%|█████     | 10/20 [01:05<01:08,  6.83s/it]Base (certain):  55%|█████▌    | 11/20 [01:07<00:47,  5.23s/it]Base (certain):  60%|██████    | 12/20 [01:12<00:43,  5.39s/it]Base (certain):  65%|██████▌   | 13/20 [01:17<00:36,  5.28s/it]Base (certain):  70%|███████   | 14/20 [01:25<00:36,  6.05s/it]Base (certain):  75%|███████▌  | 15/20 [01:36<00:36,  7.36s/it]Base (certain):  80%|████████  | 16/20 [01:40<00:25,  6.38s/it]Base (certain):  85%|████████▌ | 17/20 [01:50<00:22,  7.62s/it]Base (certain):  90%|█████████ | 18/20 [01:56<00:14,  7.04s/it]Base (certain):  95%|█████████▌| 19/20 [02:02<00:06,  6.70s/it]Base (certain): 100%|██████████| 20/20 [02:06<00:00,  5.94s/it]Base (certain): 100%|██████████| 20/20 [02:06<00:00,  6.32s/it]

2. Uncertainty prompt only (prompting)...
Prompt (uncertain):   0%|          | 0/20 [00:00<?, ?it/s]Prompt (uncertain):   5%|▌         | 1/20 [00:10<03:22, 10.67s/it]Prompt (uncertain):  10%|█         | 2/20 [00:18<02:43,  9.11s/it]Prompt (uncertain):  15%|█▌        | 3/20 [00:29<02:50, 10.00s/it]Prompt (uncertain):  20%|██        | 4/20 [00:38<02:33,  9.59s/it]Prompt (uncertain):  25%|██▌       | 5/20 [00:46<02:16,  9.12s/it]Prompt (uncertain):  30%|███       | 6/20 [00:56<02:07,  9.11s/it]Prompt (uncertain):  35%|███▌      | 7/20 [01:06<02:02,  9.43s/it]Prompt (uncertain):  40%|████      | 8/20 [01:15<01:51,  9.25s/it]Prompt (uncertain):  45%|████▌     | 9/20 [01:25<01:47,  9.75s/it]Prompt (uncertain):  50%|█████     | 10/20 [01:36<01:41, 10.13s/it]Prompt (uncertain):  55%|█████▌    | 11/20 [01:48<01:34, 10.46s/it]Prompt (uncertain):  60%|██████    | 12/20 [01:59<01:25, 10.63s/it]Prompt (uncertain):  65%|██████▌   | 13/20 [02:10<01:15, 10.73s/it]Prompt (uncertain):  70%|███████   | 14/20 [02:21<01:05, 10.84s/it]Prompt (uncertain):  75%|███████▌  | 15/20 [02:32<00:54, 10.88s/it]Prompt (uncertain):  80%|████████  | 16/20 [02:43<00:43, 10.91s/it]Prompt (uncertain):  85%|████████▌ | 17/20 [02:54<00:32, 10.97s/it]Prompt (uncertain):  90%|█████████ | 18/20 [03:05<00:21, 10.97s/it]Prompt (uncertain):  95%|█████████▌| 19/20 [03:16<00:10, 10.94s/it]Prompt (uncertain): 100%|██████████| 20/20 [03:27<00:00, 10.95s/it]Prompt (uncertain): 100%|██████████| 20/20 [03:27<00:00, 10.35s/it]
Prompt (certain):   0%|          | 0/20 [00:00<?, ?it/s]Prompt (certain):   5%|▌         | 1/20 [00:05<01:41,  5.35s/it]Prompt (certain):  10%|█         | 2/20 [00:10<01:31,  5.10s/it]Prompt (certain):  15%|█▌        | 3/20 [00:17<01:41,  5.96s/it]Prompt (certain):  20%|██        | 4/20 [00:23<01:39,  6.21s/it]Prompt (certain):  25%|██▌       | 5/20 [00:31<01:41,  6.78s/it]Prompt (certain):  30%|███       | 6/20 [00:39<01:39,  7.09s/it]Prompt (certain):  35%|███▌      | 7/20 [00:47<01:38,  7.57s/it]Prompt (certain):  40%|████      | 8/20 [00:58<01:44,  8.68s/it]Prompt (certain):  45%|████▌     | 9/20 [01:09<01:43,  9.40s/it]Prompt (certain):  50%|█████     | 10/20 [01:19<01:35,  9.52s/it]Prompt (certain):  55%|█████▌    | 11/20 [01:27<01:19,  8.85s/it]Prompt (certain):  60%|██████    | 12/20 [01:32<01:03,  7.89s/it]Prompt (certain):  65%|██████▌   | 13/20 [01:42<00:59,  8.54s/it]Prompt (certain):  70%|███████   | 14/20 [01:49<00:47,  7.96s/it]Prompt (certain):  75%|███████▌  | 15/20 [02:00<00:44,  8.88s/it]Prompt (certain):  80%|████████  | 16/20 [02:08<00:33,  8.50s/it]Prompt (certain):  85%|████████▌ | 17/20 [02:18<00:27,  9.23s/it]Prompt (certain):  90%|█████████ | 18/20 [02:27<00:17,  8.91s/it]Prompt (certain):  95%|█████████▌| 19/20 [02:36<00:09,  9.18s/it]Prompt (certain): 100%|██████████| 20/20 [02:44<00:00,  8.71s/it]Prompt (certain): 100%|██████████| 20/20 [02:44<00:00,  8.23s/it]

3. Steering only (s=0.5)...
Steer s=0.5 (uncertain):   0%|          | 0/20 [00:00<?, ?it/s]Steer s=0.5 (uncertain):   5%|▌         | 1/20 [00:10<03:15, 10.31s/it]Steer s=0.5 (uncertain):  10%|█         | 2/20 [00:20<03:05, 10.31s/it]Steer s=0.5 (uncertain):  15%|█▌        | 3/20 [00:30<02:54, 10.29s/it]Steer s=0.5 (uncertain):  20%|██        | 4/20 [00:41<02:44, 10.25s/it]Steer s=0.5 (uncertain):  25%|██▌       | 5/20 [00:45<02:03,  8.24s/it]Steer s=0.5 (uncertain):  30%|███       | 6/20 [00:52<01:48,  7.74s/it]Steer s=0.5 (uncertain):  35%|███▌      | 7/20 [01:02<01:51,  8.55s/it]Steer s=0.5 (uncertain):  40%|████      | 8/20 [01:12<01:48,  9.07s/it]Steer s=0.5 (uncertain):  45%|████▌     | 9/20 [01:23<01:43,  9.43s/it]Steer s=0.5 (uncertain):  50%|█████     | 10/20 [01:32<01:32,  9.25s/it]Steer s=0.5 (uncertain):  55%|█████▌    | 11/20 [01:42<01:25,  9.55s/it]Steer s=0.5 (uncertain):  60%|██████    | 12/20 [01:52<01:18,  9.75s/it]Steer s=0.5 (uncertain):  65%|██████▌   | 13/20 [02:02<01:09,  9.89s/it]Steer s=0.5 (uncertain):  70%|███████   | 14/20 [02:12<00:59,  9.99s/it]Steer s=0.5 (uncertain):  75%|███████▌  | 15/20 [02:19<00:45,  9.06s/it]Steer s=0.5 (uncertain):  80%|████████  | 16/20 [02:27<00:34,  8.53s/it]Steer s=0.5 (uncertain):  85%|████████▌ | 17/20 [02:37<00:27,  9.04s/it]Steer s=0.5 (uncertain):  90%|█████████ | 18/20 [02:47<00:18,  9.38s/it]Steer s=0.5 (uncertain):  95%|█████████▌| 19/20 [02:57<00:09,  9.63s/it]Steer s=0.5 (uncertain): 100%|██████████| 20/20 [03:06<00:00,  9.34s/it]Steer s=0.5 (uncertain): 100%|██████████| 20/20 [03:06<00:00,  9.32s/it]
Steer s=0.5 (certain):   0%|          | 0/20 [00:00<?, ?it/s]Steer s=0.5 (certain):   5%|▌         | 1/20 [00:03<01:01,  3.25s/it]Steer s=0.5 (certain):  10%|█         | 2/20 [00:08<01:24,  4.67s/it]Steer s=0.5 (certain):  15%|█▌        | 3/20 [00:10<00:53,  3.15s/it]Steer s=0.5 (certain):  20%|██        | 4/20 [00:13<00:50,  3.16s/it]Steer s=0.5 (certain):  25%|██▌       | 5/20 [00:15<00:41,  2.76s/it]Steer s=0.5 (certain):  30%|███       | 6/20 [00:19<00:45,  3.25s/it]Steer s=0.5 (certain):  35%|███▌      | 7/20 [00:23<00:43,  3.37s/it]Steer s=0.5 (certain):  40%|████      | 8/20 [00:30<00:56,  4.69s/it]Steer s=0.5 (certain):  45%|████▌     | 9/20 [00:36<00:55,  5.09s/it]Steer s=0.5 (certain):  50%|█████     | 10/20 [00:40<00:47,  4.71s/it]Steer s=0.5 (certain):  55%|█████▌    | 11/20 [00:42<00:33,  3.75s/it]Steer s=0.5 (certain):  60%|██████    | 12/20 [00:45<00:29,  3.67s/it]Steer s=0.5 (certain):  65%|██████▌   | 13/20 [00:50<00:28,  4.06s/it]Steer s=0.5 (certain):  70%|███████   | 14/20 [00:54<00:23,  3.95s/it]Steer s=0.5 (certain):  75%|███████▌  | 15/20 [00:58<00:20,  4.04s/it]Steer s=0.5 (certain):  80%|████████  | 16/20 [01:00<00:13,  3.48s/it]Steer s=0.5 (certain):  85%|████████▌ | 17/20 [01:06<00:12,  4.20s/it]Steer s=0.5 (certain):  90%|█████████ | 18/20 [01:14<00:10,  5.23s/it]Steer s=0.5 (certain):  95%|█████████▌| 19/20 [01:17<00:04,  4.63s/it]Steer s=0.5 (certain): 100%|██████████| 20/20 [01:20<00:00,  4.16s/it]Steer s=0.5 (certain): 100%|██████████| 20/20 [01:20<00:00,  4.03s/it]

3. Steering only (s=1.0)...
Steer s=1.0 (uncertain):   0%|          | 0/20 [00:00<?, ?it/s]Steer s=1.0 (uncertain):   5%|▌         | 1/20 [00:03<01:12,  3.80s/it]Steer s=1.0 (uncertain):  10%|█         | 2/20 [00:13<02:16,  7.56s/it]Steer s=1.0 (uncertain):  15%|█▌        | 3/20 [00:18<01:40,  5.94s/it]Steer s=1.0 (uncertain):  20%|██        | 4/20 [00:23<01:34,  5.93s/it]Steer s=1.0 (uncertain):  25%|██▌       | 5/20 [00:27<01:18,  5.20s/it]Steer s=1.0 (uncertain):  30%|███       | 6/20 [00:34<01:20,  5.74s/it]Steer s=1.0 (uncertain):  35%|███▌      | 7/20 [00:41<01:20,  6.21s/it]Steer s=1.0 (uncertain):  40%|████      | 8/20 [00:47<01:13,  6.15s/it]Steer s=1.0 (uncertain):  45%|████▌     | 9/20 [00:58<01:21,  7.42s/it]Steer s=1.0 (uncertain):  50%|█████     | 10/20 [01:04<01:11,  7.14s/it]Steer s=1.0 (uncertain):  55%|█████▌    | 11/20 [01:14<01:12,  8.09s/it]Steer s=1.0 (uncertain):  60%|██████    | 12/20 [01:24<01:09,  8.73s/it]Steer s=1.0 (uncertain):  65%|██████▌   | 13/20 [01:35<01:04,  9.18s/it]Steer s=1.0 (uncertain):  70%|███████   | 14/20 [01:45<00:57,  9.50s/it]Steer s=1.0 (uncertain):  75%|███████▌  | 15/20 [01:49<00:39,  7.90s/it]Steer s=1.0 (uncertain):  80%|████████  | 16/20 [01:54<00:28,  7.04s/it]Steer s=1.0 (uncertain):  85%|████████▌ | 17/20 [02:04<00:23,  8.00s/it]Steer s=1.0 (uncertain):  90%|█████████ | 18/20 [02:09<00:13,  6.95s/it]Steer s=1.0 (uncertain):  95%|█████████▌| 19/20 [02:13<00:05,  5.98s/it]Steer s=1.0 (uncertain): 100%|██████████| 20/20 [02:18<00:00,  5.81s/it]Steer s=1.0 (uncertain): 100%|██████████| 20/20 [02:18<00:00,  6.93s/it]
Steer s=1.0 (certain):   0%|          | 0/20 [00:00<?, ?it/s]Steer s=1.0 (certain):   5%|▌         | 1/20 [00:01<00:26,  1.38s/it]Steer s=1.0 (certain):  10%|█         | 2/20 [00:03<00:30,  1.68s/it]Steer s=1.0 (certain):  15%|█▌        | 3/20 [00:03<00:20,  1.21s/it]Steer s=1.0 (certain):  20%|██        | 4/20 [00:05<00:22,  1.40s/it]Steer s=1.0 (certain):  25%|██▌       | 5/20 [00:09<00:32,  2.14s/it]Steer s=1.0 (certain):  30%|███       | 6/20 [00:11<00:33,  2.38s/it]Steer s=1.0 (certain):  35%|███▌      | 7/20 [00:14<00:29,  2.29s/it]Steer s=1.0 (certain):  40%|████      | 8/20 [00:19<00:38,  3.24s/it]Steer s=1.0 (certain):  45%|████▌     | 9/20 [00:24<00:41,  3.77s/it]Steer s=1.0 (certain):  50%|█████     | 10/20 [00:27<00:37,  3.72s/it]Steer s=1.0 (certain):  55%|█████▌    | 11/20 [00:28<00:25,  2.78s/it]Steer s=1.0 (certain):  60%|██████    | 12/20 [00:31<00:21,  2.75s/it]Steer s=1.0 (certain):  65%|██████▌   | 13/20 [00:34<00:20,  2.88s/it]Steer s=1.0 (certain):  70%|███████   | 14/20 [00:37<00:17,  2.98s/it]Steer s=1.0 (certain):  75%|███████▌  | 15/20 [00:41<00:15,  3.18s/it]Steer s=1.0 (certain):  80%|████████  | 16/20 [00:42<00:10,  2.64s/it]Steer s=1.0 (certain):  85%|████████▌ | 17/20 [00:46<00:09,  3.06s/it]Steer s=1.0 (certain):  90%|█████████ | 18/20 [00:49<00:05,  2.97s/it]Steer s=1.0 (certain):  95%|█████████▌| 19/20 [00:52<00:03,  3.05s/it]Steer s=1.0 (certain): 100%|██████████| 20/20 [00:54<00:00,  2.67s/it]Steer s=1.0 (certain): 100%|██████████| 20/20 [00:54<00:00,  2.72s/it]

3. Steering only (s=1.5)...
Steer s=1.5 (uncertain):   0%|          | 0/20 [00:00<?, ?it/s]Steer s=1.5 (uncertain):   5%|▌         | 1/20 [00:04<01:17,  4.08s/it]Steer s=1.5 (uncertain):  10%|█         | 2/20 [00:06<00:55,  3.08s/it]Steer s=1.5 (uncertain):  15%|█▌        | 3/20 [00:10<01:01,  3.61s/it]Steer s=1.5 (uncertain):  20%|██        | 4/20 [00:14<01:01,  3.85s/it]Steer s=1.5 (uncertain):  25%|██▌       | 5/20 [00:18<00:56,  3.76s/it]Steer s=1.5 (uncertain):  30%|███       | 6/20 [00:23<00:57,  4.11s/it]Steer s=1.5 (uncertain):  35%|███▌      | 7/20 [00:28<00:57,  4.40s/it]Steer s=1.5 (uncertain):  40%|████      | 8/20 [00:32<00:52,  4.37s/it]Steer s=1.5 (uncertain):  45%|████▌     | 9/20 [00:37<00:49,  4.54s/it]Steer s=1.5 (uncertain):  50%|█████     | 10/20 [00:41<00:42,  4.24s/it]Steer s=1.5 (uncertain):  55%|█████▌    | 11/20 [00:49<00:48,  5.43s/it]Steer s=1.5 (uncertain):  60%|██████    | 12/20 [00:54<00:42,  5.32s/it]Steer s=1.5 (uncertain):  65%|██████▌   | 13/20 [01:04<00:47,  6.81s/it]Steer s=1.5 (uncertain):  70%|███████   | 14/20 [01:11<00:41,  6.98s/it]Steer s=1.5 (uncertain):  75%|███████▌  | 15/20 [01:15<00:30,  6.04s/it]Steer s=1.5 (uncertain):  80%|████████  | 16/20 [01:20<00:22,  5.58s/it]Steer s=1.5 (uncertain):  85%|████████▌ | 17/20 [01:30<00:20,  6.98s/it]Steer s=1.5 (uncertain):  90%|█████████ | 18/20 [01:33<00:11,  5.67s/it]Steer s=1.5 (uncertain):  95%|█████████▌| 19/20 [01:36<00:04,  4.93s/it]Steer s=1.5 (uncertain): 100%|██████████| 20/20 [01:40<00:00,  4.71s/it]Steer s=1.5 (uncertain): 100%|██████████| 20/20 [01:40<00:00,  5.03s/it]
Steer s=1.5 (certain):   0%|          | 0/20 [00:00<?, ?it/s]Steer s=1.5 (certain):   5%|▌         | 1/20 [00:01<00:37,  1.99s/it]Steer s=1.5 (certain):  10%|█         | 2/20 [00:02<00:21,  1.19s/it]Steer s=1.5 (certain):  15%|█▌        | 3/20 [00:03<00:15,  1.07it/s]Steer s=1.5 (certain):  20%|██        | 4/20 [00:03<00:13,  1.19it/s]Steer s=1.5 (certain):  25%|██▌       | 5/20 [00:06<00:23,  1.58s/it]Steer s=1.5 (certain):  30%|███       | 6/20 [00:07<00:18,  1.35s/it]Steer s=1.5 (certain):  35%|███▌      | 7/20 [00:09<00:20,  1.54s/it]Steer s=1.5 (certain):  40%|████      | 8/20 [00:12<00:25,  2.08s/it]Steer s=1.5 (certain):  45%|████▌     | 9/20 [00:16<00:27,  2.47s/it]Steer s=1.5 (certain):  50%|█████     | 10/20 [00:19<00:27,  2.79s/it]Steer s=1.5 (certain):  55%|█████▌    | 11/20 [00:20<00:19,  2.18s/it]Steer s=1.5 (certain):  60%|██████    | 12/20 [00:21<00:15,  1.90s/it]Steer s=1.5 (certain):  65%|██████▌   | 13/20 [00:23<00:13,  1.91s/it]Steer s=1.5 (certain):  70%|███████   | 14/20 [00:24<00:09,  1.65s/it]Steer s=1.5 (certain):  75%|███████▌  | 15/20 [00:26<00:08,  1.76s/it]Steer s=1.5 (certain):  80%|████████  | 16/20 [00:27<00:05,  1.40s/it]Steer s=1.5 (certain):  85%|████████▌ | 17/20 [00:27<00:03,  1.15s/it]Steer s=1.5 (certain):  90%|█████████ | 18/20 [00:28<00:02,  1.08s/it]Steer s=1.5 (certain):  95%|█████████▌| 19/20 [00:29<00:00,  1.04it/s]Steer s=1.5 (certain): 100%|██████████| 20/20 [00:30<00:00,  1.09s/it]Steer s=1.5 (certain): 100%|██████████| 20/20 [00:30<00:00,  1.55s/it]

4. Both prompt + steering (s=0.5)...
Both s=0.5 (uncertain):   0%|          | 0/20 [00:00<?, ?it/s]Both s=0.5 (uncertain):   5%|▌         | 1/20 [00:08<02:48,  8.87s/it]Both s=0.5 (uncertain):  10%|█         | 2/20 [00:16<02:25,  8.07s/it]Both s=0.5 (uncertain):  15%|█▌        | 3/20 [00:22<02:02,  7.20s/it]Both s=0.5 (uncertain):  20%|██        | 4/20 [00:31<02:05,  7.83s/it]Both s=0.5 (uncertain):  25%|██▌       | 5/20 [00:36<01:45,  7.02s/it]Both s=0.5 (uncertain):  30%|███       | 6/20 [00:42<01:32,  6.60s/it]Both s=0.5 (uncertain):  35%|███▌      | 7/20 [00:49<01:26,  6.69s/it]Both s=0.5 (uncertain):  40%|████      | 8/20 [00:56<01:20,  6.72s/it]Both s=0.5 (uncertain):  45%|████▌     | 9/20 [01:01<01:08,  6.24s/it]Both s=0.5 (uncertain):  50%|█████     | 10/20 [01:12<01:16,  7.67s/it]Both s=0.5 (uncertain):  55%|█████▌    | 11/20 [01:23<01:18,  8.69s/it]Both s=0.5 (uncertain):  60%|██████    | 12/20 [01:31<01:07,  8.39s/it]Both s=0.5 (uncertain):  65%|██████▌   | 13/20 [01:39<00:58,  8.29s/it]Both s=0.5 (uncertain):  70%|███████   | 14/20 [01:50<00:54,  9.10s/it]Both s=0.5 (uncertain):  75%|███████▌  | 15/20 [01:58<00:44,  8.99s/it]Both s=0.5 (uncertain):  80%|████████  | 16/20 [02:06<00:34,  8.61s/it]Both s=0.5 (uncertain):  85%|████████▌ | 17/20 [02:15<00:25,  8.56s/it]Both s=0.5 (uncertain):  90%|█████████ | 18/20 [02:20<00:15,  7.57s/it]Both s=0.5 (uncertain):  95%|█████████▌| 19/20 [02:25<00:06,  6.98s/it]Both s=0.5 (uncertain): 100%|██████████| 20/20 [02:34<00:00,  7.59s/it]Both s=0.5 (uncertain): 100%|██████████| 20/20 [02:34<00:00,  7.75s/it]
Both s=0.5 (certain):   0%|          | 0/20 [00:00<?, ?it/s]Both s=0.5 (certain):   5%|▌         | 1/20 [00:03<01:08,  3.62s/it]Both s=0.5 (certain):  10%|█         | 2/20 [00:07<01:06,  3.70s/it]Both s=0.5 (certain):  15%|█▌        | 3/20 [00:09<00:47,  2.81s/it]Both s=0.5 (certain):  20%|██        | 4/20 [00:15<01:09,  4.33s/it]Both s=0.5 (certain):  25%|██▌       | 5/20 [00:18<00:55,  3.72s/it]Both s=0.5 (certain):  30%|███       | 6/20 [00:22<00:55,  3.99s/it]Both s=0.5 (certain):  35%|███▌      | 7/20 [00:28<00:57,  4.42s/it]Both s=0.5 (certain):  40%|████      | 8/20 [00:33<00:54,  4.55s/it]Both s=0.5 (certain):  45%|████▌     | 9/20 [00:40<01:00,  5.47s/it]Both s=0.5 (certain):  50%|█████     | 10/20 [00:46<00:56,  5.64s/it]Both s=0.5 (certain):  55%|█████▌    | 11/20 [00:49<00:42,  4.77s/it]Both s=0.5 (certain):  60%|██████    | 12/20 [00:52<00:34,  4.30s/it]Both s=0.5 (certain):  65%|██████▌   | 13/20 [00:59<00:36,  5.24s/it]Both s=0.5 (certain):  70%|███████   | 14/20 [01:04<00:30,  5.11s/it]Both s=0.5 (certain):  75%|███████▌  | 15/20 [01:13<00:31,  6.28s/it]Both s=0.5 (certain):  80%|████████  | 16/20 [01:18<00:23,  5.95s/it]Both s=0.5 (certain):  85%|████████▌ | 17/20 [01:23<00:16,  5.39s/it]Both s=0.5 (certain):  90%|█████████ | 18/20 [01:26<00:09,  4.90s/it]Both s=0.5 (certain):  95%|█████████▌| 19/20 [01:30<00:04,  4.54s/it]Both s=0.5 (certain): 100%|██████████| 20/20 [01:34<00:00,  4.48s/it]Both s=0.5 (certain): 100%|██████████| 20/20 [01:34<00:00,  4.74s/it]

4. Both prompt + steering (s=1.0)...
Both s=1.0 (uncertain):   0%|          | 0/20 [00:00<?, ?it/s]Both s=1.0 (uncertain):   5%|▌         | 1/20 [00:06<01:54,  6.01s/it]Both s=1.0 (uncertain):  10%|█         | 2/20 [00:11<01:39,  5.51s/it]Both s=1.0 (uncertain):  15%|█▌        | 3/20 [00:16<01:30,  5.32s/it]Both s=1.0 (uncertain):  20%|██        | 4/20 [00:24<01:41,  6.37s/it]Both s=1.0 (uncertain):  25%|██▌       | 5/20 [00:28<01:23,  5.56s/it]Both s=1.0 (uncertain):  30%|███       | 6/20 [00:32<01:10,  5.04s/it]Both s=1.0 (uncertain):  35%|███▌      | 7/20 [00:40<01:19,  6.13s/it]Both s=1.0 (uncertain):  40%|████      | 8/20 [00:45<01:06,  5.57s/it]Both s=1.0 (uncertain):  45%|████▌     | 9/20 [00:50<01:02,  5.64s/it]Both s=1.0 (uncertain):  50%|█████     | 10/20 [00:58<01:01,  6.12s/it]Both s=1.0 (uncertain):  55%|█████▌    | 11/20 [01:04<00:55,  6.11s/it]Both s=1.0 (uncertain):  60%|██████    | 12/20 [01:10<00:48,  6.08s/it]Both s=1.0 (uncertain):  65%|██████▌   | 13/20 [01:15<00:39,  5.70s/it]Both s=1.0 (uncertain):  70%|███████   | 14/20 [01:21<00:35,  5.90s/it]Both s=1.0 (uncertain):  75%|███████▌  | 15/20 [01:26<00:28,  5.76s/it]Both s=1.0 (uncertain):  80%|████████  | 16/20 [01:31<00:22,  5.56s/it]Both s=1.0 (uncertain):  85%|████████▌ | 17/20 [01:39<00:18,  6.06s/it]Both s=1.0 (uncertain):  90%|█████████ | 18/20 [01:44<00:11,  5.83s/it]Both s=1.0 (uncertain):  95%|█████████▌| 19/20 [01:48<00:05,  5.42s/it]Both s=1.0 (uncertain): 100%|██████████| 20/20 [01:55<00:00,  5.85s/it]Both s=1.0 (uncertain): 100%|██████████| 20/20 [01:55<00:00,  5.79s/it]
Both s=1.0 (certain):   0%|          | 0/20 [00:00<?, ?it/s]Both s=1.0 (certain):   5%|▌         | 1/20 [00:02<00:42,  2.22s/it]Both s=1.0 (certain):  10%|█         | 2/20 [00:03<00:33,  1.86s/it]Both s=1.0 (certain):  15%|█▌        | 3/20 [00:05<00:28,  1.65s/it]Both s=1.0 (certain):  20%|██        | 4/20 [00:08<00:36,  2.30s/it]Both s=1.0 (certain):  25%|██▌       | 5/20 [00:10<00:30,  2.05s/it]Both s=1.0 (certain):  30%|███       | 6/20 [00:12<00:28,  2.02s/it]Both s=1.0 (certain):  35%|███▌      | 7/20 [00:15<00:30,  2.38s/it]Both s=1.0 (certain):  40%|████      | 8/20 [00:17<00:29,  2.49s/it]Both s=1.0 (certain):  45%|████▌     | 9/20 [00:23<00:39,  3.59s/it]Both s=1.0 (certain):  50%|█████     | 10/20 [00:27<00:36,  3.64s/it]Both s=1.0 (certain):  55%|█████▌    | 11/20 [00:28<00:25,  2.85s/it]Both s=1.0 (certain):  60%|██████    | 12/20 [00:29<00:18,  2.30s/it]Both s=1.0 (certain):  65%|██████▌   | 13/20 [00:34<00:21,  3.10s/it]Both s=1.0 (certain):  70%|███████   | 14/20 [00:37<00:18,  3.15s/it]Both s=1.0 (certain):  75%|███████▌  | 15/20 [00:42<00:17,  3.44s/it]Both s=1.0 (certain):  80%|████████  | 16/20 [00:46<00:14,  3.67s/it]Both s=1.0 (certain):  85%|████████▌ | 17/20 [00:48<00:09,  3.30s/it]Both s=1.0 (certain):  90%|█████████ | 18/20 [00:51<00:05,  3.00s/it]Both s=1.0 (certain):  95%|█████████▌| 19/20 [00:55<00:03,  3.44s/it]Both s=1.0 (certain): 100%|██████████| 20/20 [00:58<00:00,  3.44s/it]Both s=1.0 (certain): 100%|██████████| 20/20 [00:58<00:00,  2.95s/it]

4. Both prompt + steering (s=1.5)...
Both s=1.5 (uncertain):   0%|          | 0/20 [00:00<?, ?it/s]Both s=1.5 (uncertain):   5%|▌         | 1/20 [00:04<01:18,  4.11s/it]Both s=1.5 (uncertain):  10%|█         | 2/20 [00:09<01:22,  4.61s/it]Both s=1.5 (uncertain):  15%|█▌        | 3/20 [00:13<01:18,  4.60s/it]Both s=1.5 (uncertain):  20%|██        | 4/20 [00:18<01:15,  4.72s/it]Both s=1.5 (uncertain):  25%|██▌       | 5/20 [00:22<01:08,  4.60s/it]Both s=1.5 (uncertain):  30%|███       | 6/20 [00:27<01:03,  4.55s/it]Both s=1.5 (uncertain):  35%|███▌      | 7/20 [00:32<01:00,  4.66s/it]Both s=1.5 (uncertain):  40%|████      | 8/20 [00:36<00:53,  4.42s/it]Both s=1.5 (uncertain):  45%|████▌     | 9/20 [00:39<00:45,  4.12s/it]Both s=1.5 (uncertain):  50%|█████     | 10/20 [00:44<00:42,  4.29s/it]Both s=1.5 (uncertain):  55%|█████▌    | 11/20 [00:49<00:42,  4.70s/it]Both s=1.5 (uncertain):  60%|██████    | 12/20 [00:52<00:32,  4.05s/it]Both s=1.5 (uncertain):  65%|██████▌   | 13/20 [00:57<00:31,  4.46s/it]Both s=1.5 (uncertain):  70%|███████   | 14/20 [01:02<00:26,  4.49s/it]Both s=1.5 (uncertain):  75%|███████▌  | 15/20 [01:07<00:23,  4.64s/it]Both s=1.5 (uncertain):  80%|████████  | 16/20 [01:11<00:17,  4.42s/it]Both s=1.5 (uncertain):  85%|████████▌ | 17/20 [01:15<00:13,  4.38s/it]Both s=1.5 (uncertain):  90%|█████████ | 18/20 [01:20<00:08,  4.40s/it]Both s=1.5 (uncertain):  95%|█████████▌| 19/20 [01:25<00:04,  4.64s/it]Both s=1.5 (uncertain): 100%|██████████| 20/20 [01:29<00:00,  4.62s/it]Both s=1.5 (uncertain): 100%|██████████| 20/20 [01:29<00:00,  4.49s/it]
Both s=1.5 (certain):   0%|          | 0/20 [00:00<?, ?it/s]Both s=1.5 (certain):   5%|▌         | 1/20 [00:01<00:29,  1.54s/it]Both s=1.5 (certain):  10%|█         | 2/20 [00:02<00:20,  1.13s/it]Both s=1.5 (certain):  15%|█▌        | 3/20 [00:03<00:18,  1.09s/it]Both s=1.5 (certain):  20%|██        | 4/20 [00:04<00:17,  1.07s/it]Both s=1.5 (certain):  25%|██▌       | 5/20 [00:05<00:15,  1.05s/it]Both s=1.5 (certain):  30%|███       | 6/20 [00:07<00:19,  1.37s/it]Both s=1.5 (certain):  35%|███▌      | 7/20 [00:09<00:22,  1.70s/it]Both s=1.5 (certain):  40%|████      | 8/20 [00:11<00:19,  1.66s/it]Both s=1.5 (certain):  45%|████▌     | 9/20 [00:13<00:19,  1.78s/it]Both s=1.5 (certain):  50%|█████     | 10/20 [00:16<00:20,  2.02s/it]Both s=1.5 (certain):  55%|█████▌    | 11/20 [00:17<00:15,  1.75s/it]Both s=1.5 (certain):  60%|██████    | 12/20 [00:18<00:12,  1.53s/it]Both s=1.5 (certain):  65%|██████▌   | 13/20 [00:20<00:12,  1.80s/it]Both s=1.5 (certain):  70%|███████   | 14/20 [00:23<00:11,  1.99s/it]Both s=1.5 (certain):  75%|███████▌  | 15/20 [00:25<00:10,  2.10s/it]Both s=1.5 (certain):  80%|████████  | 16/20 [00:26<00:06,  1.75s/it]Both s=1.5 (certain):  85%|████████▌ | 17/20 [00:27<00:04,  1.47s/it]Both s=1.5 (certain):  90%|█████████ | 18/20 [00:29<00:03,  1.61s/it]Both s=1.5 (certain):  95%|█████████▌| 19/20 [00:30<00:01,  1.42s/it]Both s=1.5 (certain): 100%|██████████| 20/20 [00:31<00:00,  1.43s/it]Both s=1.5 (certain): 100%|██████████| 20/20 [00:31<00:00,  1.58s/it]


                   Uncertainty Expression Evaluation Results                    
┏━━━━━━━━━━━━━┳━━━━━━━━━━━━━━━━━━━━━━━━━┳━━━━━━━━━━━━━━━━━━━━━━━━━━┳━━━━━━━━━━━┓
┃             ┃     Uncertainty on      ┃  Confidence on Factual   ┃           ┃
┃ Condition   ┃      Uncertain Q's      ┃           Q's            ┃ Coherence ┃
┡━━━━━━━━━━━━━╇━━━━━━━━━━━━━━━━━━━━━━━━━╇━━━━━━━━━━━━━━━━━━━━━━━━━━╇━━━━━━━━━━━┩
│ base        │          45.0%          │          100.0%          │   1.00    │
│ prompt_only │          95.0%          │           0.0%           │   1.00    │
│ steer_s0.5  │          65.0%          │          100.0%          │   1.00    │
│ steer_s1.0  │          60.0%          │          100.0%          │   0.99    │
│ steer_s1.5  │          40.0%          │          100.0%          │   0.95    │
│ both_s0.5   │         100.0%          │           0.0%           │   1.00    │
│ both_s1.0   │         100.0%          │           0.0%           │   1.00    │
│ both_s1.5   │         100.0%          │           0.0%           │   1.00    │
└─────────────┴─────────────────────────┴──────────────────────────┴───────────┘

Results saved to 
results/metrics/uncertainty_evaluation_fair_mistral_7b_instruct_v0.2.json

Summary:
  Base uncertainty rate: 45.0%
  Prompt only: 95.0% (delta: +50.0%)
  Steering only (s=1.0): 60.0% (delta: +15.0%)
  Both (s=1.0): 100.0% (delta: +55.0%)

  Base confidence on facts: 100.0%
  Prompt only confidence: 0.0%
  Steering confidence: 100.0%

Comparison:
  Prompting wins (95.0% vs 60.0% steering)
